{
  "entry_id": "PWR-RTG-0042-REVC",
  "legacy_id": "MMOD-RTG-PLUTONIUM-2100-REV3",
  "category": {
    "primary": "PWR",
    "secondary": "放射性同位素发电",
    "code": "PWR-RTG",
    "display_name": "动力系统 - 放射性同位素热电机"
  },
  "title": {
    "full": "MMOD-2100型 多任务放射性同位素热电机系统技术手册",
    "short": "MMOD-2100 RTG系统",
    "document_number": "TM-PWR-RTG-0042"
  },
  "technical_content": {
    "abstract": "本文档详细说明了MMOD-2100型多任务放射性同位素热电机(RTG)的设计规格、操作程序和安全要求。该设备采用钚-238二氧化物燃料芯块，设计寿命不少于17年，额定电功率输出110W。本手册适用于深空探测、极地科考站及密闭环境生命维持系统的电力供应应用。",
    "description": {
      "overview": "MMOD-2100型RTG是一种基于塞贝克效应的热电转换装置，通过放射性同位素衰变产生的热能直接转换为电能。该设备无需运动部件，具有极高的可靠性，适用于无法使用太阳能电池板或传统燃料发电机的极端环境。\n\n本系统由以下主要子系统组成：\n- 通用热源(GPHS)模块：包含钚-238燃料芯块\n- 热电转换模块：硅锗(SiGe)热电偶阵列\n- 散热系统：铝制散热鳍片组\n- 多层绝缘(MLI)外壳：提供热保护和辐射屏蔽\n- 电气接口：标准28V直流输出\n\n本设备符合NASA-STD-8719.23放射性同位素动力系统安全标准，并已通过DOE批准用于空间任务应用。",
      "principles": [
        "塞贝克效应原理：当两种不同导体或半导体构成回路且两个接点处于不同温度时，回路中会产生热电势。MMOD-2100采用P型与N型硅锗合金热电偶，热端温度维持约1273K，冷端温度约573K，产生约700mV的单对热电偶输出电压。",
        "热源设计：通用热源(GPHS)模块包含4个独立的燃料包壳，每个包壳内有2个钚-238二氧化物燃料芯块。燃料芯块采用烧结工艺制成，直径约50mm，高度约50mm，初始热功率约62.5W。燃料包壳由铱合金制成，可承受再入大气层时的极端条件。",
        "热电转换效率：系统总热电转换效率约为6.3%，这是由硅锗材料在操作温度范围内的性能特性决定的。虽然效率较低，但系统的无运动部件设计提供了无与伦比的长期可靠性。",
        "功率衰减：由于钚-238的半衰期为87.7年，系统电功率输出将以约0.787%/年的速率衰减。任务规划时必须考虑此衰减特性，确保任务末期仍有足够的功率余量。"
      ],
      "applications": [
        "深空探测器主电源：适用于超出木星轨道、太阳辐射不足以支持太阳能板供电的任务",
        "极地科考站辅助电源：在极夜期间提供持续电力供应",
        "地下设施生命维持系统：为密闭环境提供可靠电力",
        "行星表面着陆器：在尘暴频繁或光照条件恶劣的行星表面",
        "应急备用电源：关键基础设施的备用电力系统"
      ],
      "limitations": [
        "功率质量比限制：RTG系统的比功率约为5.4 W/kg，远低于太阳能电池板或燃料电池",
        "热管理要求：系统运行时产生大量废热，需要有效的散热设计",
        "辐射屏蔽需求：虽然外壳提供辐射屏蔽，但在人员接近区域需要额外防护措施",
        "发射前审批：由于涉及核材料，发射前需要获得核管理委员会(NRC)和国务院的批准",
        "成本因素：燃料生产和系统制造成本高昂，仅适用于高价值任务"
      ]
    },
    "diagrams": [
      {
        "diagram_id": "PWR-RTG-0042-D001",
        "type": "cross_section",
        "title": "图1：MMOD-2100 RTG 剖面图",
        "source": {
          "type": "interactive_svg",
          "url": "/assets/diagrams/pwr-rtg-0042-d001.svg",
          "interactive_config": {
            "zoom_levels": [
              0.5,
              1.0,
              1.5,
              2.0
            ],
            "hotspots_enabled": true,
            "layers": [
              "structure",
              "thermal",
              "electrical"
            ]
          }
        },
        "annotations": [
          {
            "id": "A1",
            "label": "1",
            "description": "通用热源(GPHS)模块 - 包含钚-238燃料芯块",
            "position": {
              "x": 50,
              "y": 50
            },
            "hotspot": {
              "x": 45,
              "y": 45,
              "width": 20,
              "height": 20
            }
          },
          {
            "id": "A2",
            "label": "2",
            "description": "热电偶阵列 - 312对SiGe热电偶",
            "position": {
              "x": 80,
              "y": 50
            },
            "hotspot": {
              "x": 75,
              "y": 40,
              "width": 15,
              "height": 25
            }
          },
          {
            "id": "A3",
            "label": "3",
            "description": "铝制散热鳍片 - 提供冷端散热",
            "position": {
              "x": 110,
              "y": 50
            },
            "hotspot": {
              "x": 100,
              "y": 30,
              "width": 25,
              "height": 40
            }
          },
          {
            "id": "A4",
            "label": "4",
            "description": "多层绝缘(MLI)外壳 - 热保护和辐射屏蔽",
            "position": {
              "x": 30,
              "y": 80
            },
            "hotspot": {
              "x": 20,
              "y": 20,
              "width": 100,
              "height": 80
            }
          },
          {
            "id": "A5",
            "label": "5",
            "description": "电气输出接口 - 28V DC标准输出",
            "position": {
              "x": 120,
              "y": 90
            },
            "hotspot": {
              "x": 115,
              "y": 85,
              "width": 15,
              "height": 15
            }
          }
        ],
        "callouts": [
          {
            "id": "C1",
            "text": "燃料芯块直径：50.8mm",
            "related_part": "A1"
          },
          {
            "id": "C2",
            "text": "热电偶间距：3.2mm",
            "related_part": "A2"
          },
          {
            "id": "C3",
            "text": "散热鳍片总面积：1.2m²",
            "related_part": "A3"
          }
        ]
      },
      {
        "diagram_id": "PWR-RTG-0042-D002",
        "type": "schematic",
        "title": "图2：热电转换电路原理图",
        "source": {
          "type": "svg",
          "url": "/assets/diagrams/pwr-rtg-0042-d002.svg"
        },
        "annotations": [
          {
            "id": "B1",
            "label": "P/N",
            "description": "P型/N型热电偶对",
            "position": {
              "x": 60,
              "y": 40
            }
          },
          {
            "id": "B2",
            "label": "OUT",
            "description": "28V DC输出端子",
            "position": {
              "x": 120,
              "y": 50
            }
          }
        ]
      },
      {
        "diagram_id": "PWR-RTG-0042-D003",
        "type": "data_plot",
        "title": "图3：功率输出衰减曲线（BOL至EOL）",
        "source": {
          "type": "interactive_svg",
          "url": "/assets/diagrams/pwr-rtg-0042-d003.svg",
          "interactive_config": {
            "data_points": true,
            "tooltip_enabled": true
          }
        }
      }
    ],
    "specifications": {
      "tables": [
        {
          "table_id": "T1",
          "title": "表1：电气性能规格",
          "subtitle": "标准测试条件：环境温度293K，真空环境",
          "columns": [
            {
              "key": "parameter",
              "header": "参数",
              "data_type": "string"
            },
            {
              "key": "value",
              "header": "数值",
              "data_type": "string"
            },
            {
              "key": "unit",
              "header": "单位",
              "data_type": "string"
            },
            {
              "key": "condition",
              "header": "条件",
              "data_type": "string"
            }
          ],
          "rows": [
            {
              "parameter": "额定电功率输出",
              "value": "110",
              "unit": "W",
              "condition": "BOL, 真空"
            },
            {
              "parameter": "最小电功率输出",
              "value": "95",
              "unit": "W",
              "condition": "EOL(17年), 真空"
            },
            {
              "parameter": "输出电压",
              "value": "28±2",
              "unit": "V DC",
              "condition": "额定负载"
            },
            {
              "parameter": "输出电流",
              "value": "3.93",
              "unit": "A",
              "condition": "额定功率"
            },
            {
              "parameter": "内部电阻",
              "value": "5.2",
              "unit": "Ω",
              "condition": "25°C"
            },
            {
              "parameter": "功率衰减率",
              "value": "0.787",
              "unit": "%/年",
              "condition": "标称值"
            },
            {
              "parameter": "热电转换效率",
              "value": "6.3",
              "unit": "%",
              "condition": "设计值"
            }
          ],
          "notes": [
            "BOL = Beginning of Life (寿命初期)",
            "EOL = End of Life (寿命末期)",
            "所有数值为设计目标值，实际性能可能有±5%偏差"
          ]
        },
        {
          "table_id": "T2",
          "title": "表2：热性能规格",
          "columns": [
            {
              "key": "parameter",
              "header": "参数",
              "data_type": "string"
            },
            {
              "key": "value",
              "header": "数值",
              "unit": "单位",
              "data_type": "string"
            }
          ],
          "rows": [
            {
              "parameter": "燃料初始热功率",
              "value": "2000",
              "unit": "W"
            },
            {
              "parameter": "热端温度",
              "value": "1273",
              "unit": "K"
            },
            {
              "parameter": "冷端温度",
              "value": "573",
              "unit": "K"
            },
            {
              "parameter": "温差",
              "value": "700",
              "unit": "K"
            },
            {
              "parameter": "废热功率",
              "value": "1890",
              "unit": "W"
            },
            {
              "parameter": "表面温度(运行中)",
              "value": "423-473",
              "unit": "K"
            },
            {
              "parameter": "表面温度(储存)",
              "value": "<333",
              "unit": "K"
            }
          ]
        },
        {
          "table_id": "T3",
          "title": "表3：物理规格",
          "columns": [
            {
              "key": "parameter",
              "header": "参数",
              "data_type": "string"
            },
            {
              "key": "value",
              "header": "数值",
              "unit": "单位",
              "data_type": "string"
            }
          ],
          "rows": [
            {
              "parameter": "总长度",
              "value": "1130",
              "unit": "mm"
            },
            {
              "parameter": "最大直径",
              "value": "420",
              "unit": "mm"
            },
            {
              "parameter": "总质量",
              "value": "20.4",
              "unit": "kg"
            },
            {
              "parameter": "燃料质量(Pu-238)",
              "value": "4.8",
              "unit": "kg"
            },
            {
              "parameter": "比功率",
              "value": "5.4",
              "unit": "W/kg"
            },
            {